$ mysql -u root -p
mysql> show databases;
+--------------------+
| Database           |
+--------------------+
| information_schema |
| mysql              |
| performance_schema |
+--------------------+
3 rows in set (0.00 sec)

mysql> create database bhagyesh;
Query OK, 1 row affected (0.00 sec)

mysql> use bhagyesh;
Database changed
mysql> show tables;
Empty set (0.00 sec)

mysql> create table audit_Details(prn varchar(20),Dept_Name varchar(20));
Query OK, 0 rows affected (0.23 sec)

mysql> insert into audit_Details values('11546754742','IT'),('653653786495','COMP');
Query OK, 2 rows affected (0.03 sec)
Records: 2  Duplicates: 0  Warnings: 0

mysql> select * from audit_Details\G;
*************************** 1. row ***************************
      prn: 11546754742
Dept_Name: IT
*************************** 2. row ***************************
      prn: 653653786495
Dept_Name: COMP
2 rows in set (0.00 sec)

ERROR: 
No query specified

mysql> update audit_Details SET prn='123456789' Where Dept_Name='COMP';
Query OK, 1 row affected (0.02 sec)
Rows matched: 1  Changed: 1  Warnings: 0

mysql> select * from audit_Details;
+-------------+-----------+
| prn         | Dept_Name |
+-------------+-----------+
| 11546754742 | IT        |
| 123456789   | COMP      |
+-------------+-----------+
2 rows in set (0.00 sec)

mysql> delete from audit_Details where Dept_Name='IT';
Query OK, 1 row affected (0.03 sec)

mysql> select * from audit_Details;
+-----------+-----------+
| prn       | Dept_Name |
+-----------+-----------+
| 123456789 | COMP      |
+-----------+-----------+
1 row in set (0.00 sec)

mysql> describe audit_Details;
+-----------+-------------+------+-----+---------+-------+
| Field     | Type        | Null | Key | Default | Extra |
+-----------+-------------+------+-----+---------+-------+
| prn       | varchar(20) | YES  |     | NULL    |       |
| Dept_Name | varchar(20) | YES  |     | NULL    |       |
+-----------+-------------+------+-----+---------+-------+
2 rows in set (0.00 sec)

mysql> exit
Bye

